"","name_1","name_2","name_3","name_4"
"1","Armed Forces APPG","Armed Forces Community APPG","Armed Forces Covenant APPG",NA
"2","Aviation, Travel and Aerospace APPG","Aviation APPG",NA,NA
"3","Babies (Pregnancy to Age 2) APPG","Baby Loss APPG",NA,NA
"4","Black Health APPG","Black Maternal Health APPG",NA,NA
"5","Blockchain APPG","Blockchain Technologies APPG",NA,NA
"6","Bus and Coach APPG","Bus and Coach Industry APPG",NA,NA
"7","Civil Society and Volunteering APPG","Civic Societies APPG",NA,NA
"8","Conflict Issues APPG","Conflict Prevention, Conflict Resolution and Peacebuilding APPG",NA,NA
"9","Corporate Governance APPG","Corporate Responsibility APPG",NA,NA
"10","Vaping APPG","Responsible Vaping APPG",NA,NA
"11","Russia and Democracy APPG","Russia APPG",NA,NA
"12","Creative Health APPG","Creative Diversity APPG",NA,NA
"13","Crossrail APPG","Crossrail Two APPG",NA,NA
"14","Curry Industry APPG","British Curry Catering Industry APPG",NA,NA
"15","Defence Technology APPG","Defence and Security Issues APPG","Defence and Security Sectors Supporting Local Communities APPG",NA
"16","Domestic Abuse APPG","Domestic Violence and Abuse APPG",NA,NA
"17","Domestic Abuse APPG","Domestic Violence APPG",NA,NA
"18","Dominica APPG","Dominican Republic APPG",NA,NA
"19","European Union APPG","Europe APPG",NA,NA
"20","Fair Trade APPG","Fair Value in the Food Supply Chain APPG",NA,NA
"21","Fairtrade APPG","Fair Value in the Food Supply Chain APPG",NA,NA
"22","Film Industry APPG","Film and Production Industry APPG",NA,NA
"23","Film and Broader Screen APPG","Film and Production Industry APPG",NA,NA
"24","Food and Drink APPG","Food and Drink Supply Chain APPG",NA,NA
"25","Food and Drink Manufacturing APPG","Food and Drink Supply Chain APPG",NA,NA
"26","Football APPG","Football Club APPG","Football Supporters APPG",NA
"27","Gaps in Covid-19 Financial Support APPG","Gaps in Support APPG",NA,NA
"29","Interfaith APPG","Interfaith Dialogue APPG",NA,NA
"30","Inter-Faith APPG","Interfaith Dialogue APPG",NA,NA
"31","Northern Ireland APPG","Northern Ireland Economy APPG",NA,NA
"32","South West Rail APPG","South Western Railway APPG",NA,NA
"33","Water and Sanitation in the Third World APPG","Water, Sanitation and Hygiene APPG",NA,NA
"34","Yazidi People APPG","Yazidis APPG",NA,NA
